{
  "artifact": {
    "contract": "sley-tools.native-program-artifact.v0",
    "path": "artifact/before-review.json",
    "sha256": "ec5dff328d261980750771c5241f731cbe1ba0aa7cb4fb3ec3b511d4981169dd"
  },
  "contract": "sley-tools.program.v0",
  "core": {
    "binary_sha256": "90f48df4d8b983d4bb643bd7c6663f990c33c5927f8ff6217db86d8275b7fd0e",
    "commit": "c748dda18c1276687cc3b0d1ef9b7f257eb09b24",
    "profile": "extended_v1"
  },
  "entrypoint": {
    "function_id": "cc720d48120141a26f93716919a245bb09693844901cfc05e505c864412516ae",
    "name": "evaluate",
    "state_root": "47240956e855405dcdfb067f21b3b176f13beb3519056908ce6e0f4de29423f1"
  },
  "host_responsibility": "typed input validation, local workspace lifecycle, and presentation",
  "imported_source_artifact": {
    "contract": "sley-tools.native-program-artifact.v0",
    "path": "artifact/native-program.json",
    "sha256": "19e829206cb66469d103982490ffec339f466408e02da6dc7f7ecd1981dcbecb"
  },
  "inputs": {
    "artifact_verified": "Bool",
    "blocking_findings": "UInt32 0..4294967295",
    "test_run_completed": "Bool",
    "tests_failed": "UInt32 0..4294967295"
  },
  "license_status": "Apache-2.0",
  "native_logic": "four reason flags and allow decision",
  "output": {
    "fields": {
      "allow": "Bool",
      "artifact_unverified": "Bool",
      "blocking_findings_exceeded": "Bool",
      "test_run_incomplete": "Bool",
      "tests_failed": "Bool"
    },
    "type": "Record"
  },
  "program_id": "release-readiness",
  "program_version": "0.1.0-imported",
  "purpose": "Decide whether supplied test, artifact, and blocking-finding facts permit release",
  "result_fields": [
    {
      "member_id": "0101010101010101010101010101010101010101010101010101010101010101",
      "name": "allow"
    },
    {
      "member_id": "0202020202020202020202020202020202020202020202020202020202020202",
      "name": "test_run_incomplete"
    },
    {
      "member_id": "0303030303030303030303030303030303030303030303030303030303030303",
      "name": "tests_failed"
    },
    {
      "member_id": "0404040404040404040404040404040404040404040404040404040404040404",
      "name": "artifact_unverified"
    },
    {
      "member_id": "0505050505050505050505050505050505050505050505050505050505050505",
      "name": "blocking_findings_exceeded"
    }
  ],
  "result_type_id": "27938275463db76850f4b75754662ab30aed5b1fcfc5f8e2c1a17b6d645d05dc",
  "source_provenance": {
    "builder": "crates/backend/src/main.rs",
    "core_commit": "c748dda18c1276687cc3b0d1ef9b7f257eb09b24"
  },
  "status": "portable_native_artifact",
  "test_cases": {
    "external_assertions": "sley-tools test --project PROJECT",
    "independent_oracle": "crates/backend/src/bin/sley_tools/starter.rs::expected_flags",
    "native_core_test_admission": "PENDING_CORE_EXECUTOR"
  },
  "title": "Release Readiness",
  "tools_contract": "sley-tools.cli.v0",
  "worked_change": {
    "example_threshold": 2,
    "initial_threshold": 0,
    "operation": "replace max_blocking_findings constant by exact old-object precondition"
  }
}
