{
  "artifact": {
    "contract": "sley-tools.native-program-artifact.v0",
    "path": "artifact/before-review.json",
    "sha256": "698d1c8089b010e70d127ce0d4a13b9f35df14c9f3dd273ee095d192df21e443"
  },
  "contract": "sley-tools.program.v0",
  "core": {
    "binary_sha256": "b2d8ce53051043cd86f0c071b16584053d9a08ec7af5d2d8a91fa3ab68a79e52",
    "commit": "af34be33eb1ae913dddd92aa7f4f275aac0e45ee",
    "profile": "extended_v1"
  },
  "entrypoint": {
    "function_id": "9b0cc3edcaf80d4fe0320fa0103a15b742212a27b3deb2d76cf36847ab451ecd",
    "name": "evaluate",
    "state_root": "84d22c2a87af00cf3c8da538281c14da93d73be82549f1b3a55f3fe3a62fee8a"
  },
  "host_responsibility": "typed input validation, local workspace lifecycle, and presentation",
  "imported_source_artifact": {
    "contract": "sley-tools.native-program-artifact.v0",
    "path": "artifact/native-program.json",
    "sha256": "41507712d5a61a75241733371bb16d46e680b2a074df2a4fc3cd5234a999e516"
  },
  "inputs": {
    "available_memory_mib": "SInt64 0..9223372036854775807",
    "available_workers": "SInt64 0..9223372036854775807",
    "requested_memory_mib": "SInt64 0..9223372036854775807",
    "requested_workers": "SInt64 0..9223372036854775807"
  },
  "license_status": "Apache-2.0",
  "native_logic": "signed comparisons for invalid values and insufficient capacity; exact memory fit is allowed",
  "output": {
    "fields": {
      "allow": "Bool",
      "available_memory_mib": "SInt64",
      "insufficient_memory": "Bool",
      "insufficient_workers": "Bool",
      "invalid_capacity": "Bool",
      "invalid_request": "Bool",
      "requested_memory_mib": "SInt64"
    },
    "type": "Record"
  },
  "program_id": "resource-admission",
  "program_version": "0.1.0-imported",
  "purpose": "Decide whether a requested bounded job fits supplied worker and memory capacity",
  "result_fields": [
    {
      "member_id": "0101010101010101010101010101010101010101010101010101010101010101",
      "name": "allow",
      "type": "Bool"
    },
    {
      "member_id": "0202020202020202020202020202020202020202020202020202020202020202",
      "name": "invalid_request",
      "type": "Bool"
    },
    {
      "member_id": "0303030303030303030303030303030303030303030303030303030303030303",
      "name": "invalid_capacity",
      "type": "Bool"
    },
    {
      "member_id": "0404040404040404040404040404040404040404040404040404040404040404",
      "name": "insufficient_workers",
      "type": "Bool"
    },
    {
      "member_id": "0505050505050505050505050505050505050505050505050505050505050505",
      "name": "insufficient_memory",
      "type": "Bool"
    },
    {
      "member_id": "0606060606060606060606060606060606060606060606060606060606060606",
      "name": "requested_memory_mib",
      "type": "SInt64"
    },
    {
      "member_id": "0707070707070707070707070707070707070707070707070707070707070707",
      "name": "available_memory_mib",
      "type": "SInt64"
    }
  ],
  "result_type_id": "4c07923af282bfbbcf3f106e8b3b088d07b86d308fac95570604ea8193c90d8e",
  "source_provenance": {
    "builder": "crates/backend/src/resource.rs",
    "core_commit": "af34be33eb1ae913dddd92aa7f4f275aac0e45ee"
  },
  "status": "portable_native_artifact",
  "test_cases": {
    "external_assertions": "sley-tools test --project PROJECT",
    "independent_oracle": "crates/backend/src/bin/sley_tools/starter.rs::test_resource",
    "native_core_test_admission": "PENDING_CORE_EXECUTOR"
  },
  "title": "Resource Admission",
  "tools_contract": "sley-tools.cli.v0",
  "worked_change": {
    "example_require_memory_spare": true,
    "initial_require_memory_spare": false,
    "operation": "replace exact memory capacity comparison under old-object precondition"
  }
}
