{
  "artifact": {
    "contract": "sley-tools.native-graph-artifact.v1",
    "path": "artifact/native-graph.json",
    "sha256": "4ac85d5e321073c15d24fbd7c1bb555dcf6ba3344d0a0625287fe4ae669bcdbb"
  },
  "authoring_profile": "graph_v0",
  "contract": "sley-tools.program.v0",
  "core": {
    "binary_sha256": "b2d8ce53051043cd86f0c071b16584053d9a08ec7af5d2d8a91fa3ab68a79e52",
    "commit": "af34be33eb1ae913dddd92aa7f4f275aac0e45ee",
    "profile": "extended_v1"
  },
  "entrypoint": {
    "function_id": "1af006088a0f3c3c28475ee1addc819f4ec6c82211b5de08f952f5ef65c5540e",
    "name": "evaluate",
    "state_root": "1f957d86a6786c71d1dbac7d86ff71041fdd489655c7bfced1228c3e63d91625"
  },
  "graph_recipe": {
    "path": "build/graph.json",
    "sha256": "d41d58454281a041bf0a026278c425e98fe10bc8df9575751e8645c3d70df61a"
  },
  "host_responsibility": "decode bounded JSON Lines, preserve case IDs and order, invoke accepted native programs, and serialize results",
  "inputs": {
    "baseline_archive_bytes": "SInt64",
    "baseline_cpu_us": "SInt64",
    "baseline_wall_us": "SInt64",
    "candidate_archive_bytes": "SInt64",
    "candidate_cpu_us": "SInt64",
    "candidate_wall_us": "SInt64"
  },
  "license_status": "Apache-2.0",
  "native_logic": "native regression predicate, valid-input flag, and candidate measurement projection",
  "output": {
    "fields": {
      "candidate_archive_bytes": "SInt64",
      "candidate_cpu_us": "SInt64",
      "candidate_wall_us": "SInt64",
      "invalid_input": "Bool",
      "selected": "Bool"
    },
    "type": "Record"
  },
  "program_id": "benchmark-selector",
  "program_version": "0.1.0-local",
  "purpose": "Select matched rows with any regression and project candidate measurements using native logic",
  "result_fields": [
    {
      "member_id": "0101010101010101010101010101010101010101010101010101010101010101",
      "name": "selected",
      "type": "Bool"
    },
    {
      "member_id": "0202020202020202020202020202020202020202020202020202020202020202",
      "name": "candidate_wall_us",
      "type": "SInt64"
    },
    {
      "member_id": "0303030303030303030303030303030303030303030303030303030303030303",
      "name": "candidate_cpu_us",
      "type": "SInt64"
    },
    {
      "member_id": "0404040404040404040404040404040404040404040404040404040404040404",
      "name": "candidate_archive_bytes",
      "type": "SInt64"
    },
    {
      "member_id": "0505050505050505050505050505050505050505050505050505050505050505",
      "name": "invalid_input",
      "type": "Bool"
    }
  ],
  "result_type_id": "840068ab8ae24729337ff4abc3bae9af64d216141a9be167affc40597a2e03a1",
  "source_provenance": {
    "builder": "crates/backend/src/graph.rs",
    "core_commit": "af34be33eb1ae913dddd92aa7f4f275aac0e45ee"
  },
  "status": "portable_native_artifact",
  "test_cases": {
    "external_assertions": "sley-tools test --project PROJECT",
    "independent_oracle": "scripts/probe_data_pipe_native.py::selector_oracle",
    "native_core_test_admission": "PENDING_CORE_EXECUTOR"
  },
  "title": "Benchmark Selector and Projector",
  "tools_contract": "sley-tools.cli.v0",
  "worked_change": {
    "constant": "include_nonregressions",
    "evidence": "evidence/catalog/benchmark-selector-v2.json",
    "example_value": true,
    "initial_value": false,
    "operation": "replace_named_constant"
  }
}
