{
  "artifact": {
    "contract": "sley-tools.native-graph-artifact.v1",
    "path": "artifact/native-graph.json",
    "sha256": "aaec8ce8f4e69067df78733c16796082b30a7248a9228447dc3dcb1441abf808"
  },
  "authoring_profile": "graph_v0",
  "contract": "sley-tools.program.v0",
  "core": {
    "binary_sha256": "b2d8ce53051043cd86f0c071b16584053d9a08ec7af5d2d8a91fa3ab68a79e52",
    "commit": "af34be33eb1ae913dddd92aa7f4f275aac0e45ee",
    "profile": "extended_v1"
  },
  "entrypoint": {
    "function_id": "b278e27c78ae4389705ae2a476392af0817d596e6f911ec74649b8242db5d094",
    "name": "evaluate",
    "state_root": "cc581982efec1718ffe744ccedea68f15c18465a08c8e83cc3b20861d3560d67"
  },
  "graph_recipe": {
    "path": "build/graph.json",
    "sha256": "6652ee903ca10b01edc0a713c82a5658ab06bcb6226feebc9a90efbf57b580d3"
  },
  "host_responsibility": "decode typed signed inputs, manage the local workspace, and compare public expected results",
  "inputs": {
    "limit": "SInt64",
    "used": "SInt64"
  },
  "license_status": "Apache-2.0",
  "native_logic": "reject negative inputs, branch on exhaustion before safe checked subtraction, and report an editable usage notification threshold",
  "output": {
    "fields": {
      "at_notification_level": "Bool",
      "exhausted": "Bool",
      "invalid_input": "Bool",
      "remaining": "CheckedSInt64"
    },
    "type": "Record"
  },
  "program_id": "quota-remaining",
  "program_version": "0.1.0-local",
  "purpose": "Compute nonnegative remaining quota, report exhaustion, and expose an editable usage notification threshold",
  "result_fields": [
    {
      "member_id": "0101010101010101010101010101010101010101010101010101010101010101",
      "name": "remaining",
      "type": "CheckedSInt64"
    },
    {
      "member_id": "0202020202020202020202020202020202020202020202020202020202020202",
      "name": "exhausted",
      "type": "Bool"
    },
    {
      "member_id": "0303030303030303030303030303030303030303030303030303030303030303",
      "name": "invalid_input",
      "type": "Bool"
    },
    {
      "member_id": "0404040404040404040404040404040404040404040404040404040404040404",
      "name": "at_notification_level",
      "type": "Bool"
    }
  ],
  "result_type_id": "9fb4561e16dec183b11e9f38b2c10663c2b4406b4ae622eb60a818c07a09681b",
  "source_provenance": {
    "builder": "crates/backend/src/graph.rs",
    "core_commit": "af34be33eb1ae913dddd92aa7f4f275aac0e45ee"
  },
  "status": "portable_native_artifact",
  "test_cases": {
    "external_assertions": "sley-tools test --project PROJECT",
    "independent_oracle": "scripts/probe_quota_catalog.py::quota_oracle",
    "native_core_test_admission": "PENDING_CORE_EXECUTOR"
  },
  "title": "Quota Remaining",
  "tools_contract": "sley-tools.cli.v0",
  "worked_change": {
    "constant": "notify_at_used",
    "evidence": "evidence/catalog/quota-remaining-v2.json",
    "example_value": "6",
    "initial_value": "8",
    "operation": "replace_named_constant"
  }
}
