{
  "artifact": {
    "contract": "sley-tools.native-graph-artifact.v1",
    "path": "artifact/native-graph.json",
    "sha256": "46ecaccb0b614488f67bdced54fbd4c8fc0e71bf6a058cf96f6205f1584495fe"
  },
  "authoring_profile": "graph_v0",
  "contract": "sley-tools.program.v0",
  "core": {
    "binary_sha256": "90f48df4d8b983d4bb643bd7c6663f990c33c5927f8ff6217db86d8275b7fd0e",
    "commit": "c748dda18c1276687cc3b0d1ef9b7f257eb09b24",
    "profile": "extended_v1"
  },
  "entrypoint": {
    "function_id": "49dadef4e8046b985b234dad52ecc36c2d3aaddfa94d91325a57cd51dd38cb30",
    "name": "evaluate",
    "state_root": "3a48198c32730cf4c363a1510b40277a1326c028297461788b0f093334a51eb9"
  },
  "graph_recipe": {
    "path": "build/graph.json",
    "sha256": "876d5469bae5ab54308a9b8e3d816a71a31c2ab27709611bf2e8f7ce9ba6f956"
  },
  "host_responsibility": "decode typed signed input, manage the local workspace, and compare public expected results",
  "inputs": {
    "value": "SInt64"
  },
  "license_status": "Apache-2.0",
  "native_logic": "native reversed-bound rejection and signed clamp branches with exact endpoint behavior",
  "output": {
    "fields": {
      "above_upper": "Bool",
      "below_lower": "Bool",
      "clamped_value": "SInt64",
      "invalid_bounds": "Bool"
    },
    "type": "Record"
  },
  "program_id": "bounded-clamp",
  "program_version": "0.1.0-local",
  "purpose": "Clamp a signed value to configured inclusive bounds and reject reversed configuration",
  "result_fields": [
    {
      "member_id": "0101010101010101010101010101010101010101010101010101010101010101",
      "name": "clamped_value",
      "type": "SInt64"
    },
    {
      "member_id": "0202020202020202020202020202020202020202020202020202020202020202",
      "name": "invalid_bounds",
      "type": "Bool"
    },
    {
      "member_id": "0303030303030303030303030303030303030303030303030303030303030303",
      "name": "below_lower",
      "type": "Bool"
    },
    {
      "member_id": "0404040404040404040404040404040404040404040404040404040404040404",
      "name": "above_upper",
      "type": "Bool"
    }
  ],
  "result_type_id": "c727902787752fcf5a14643e2b7a8ec5901b35454c8b790e58aabc0742f26744",
  "source_provenance": {
    "builder": "crates/backend/src/graph.rs",
    "core_commit": "c748dda18c1276687cc3b0d1ef9b7f257eb09b24"
  },
  "status": "portable_native_artifact",
  "test_cases": {
    "external_assertions": "sley-tools test --project PROJECT",
    "independent_oracle": "scripts/probe_clamp_catalog.py::clamp_oracle",
    "native_core_test_admission": "PENDING_CORE_EXECUTOR"
  },
  "title": "Bounded Clamp",
  "tools_contract": "sley-tools.cli.v0",
  "worked_change": {
    "constant": "upper_bound",
    "evidence": "evidence/catalog/bounded-clamp-v1.json",
    "example_value": "6",
    "initial_value": "5",
    "operation": "replace_named_constant"
  }
}
