{
  "artifact": {
    "contract": "sley-tools.native-graph-artifact.v1",
    "path": "artifact/native-graph.json",
    "sha256": "a3f47d13bad660ab40cd17014b00efeb6dca5b76fde836034bd7c0408ae4a5ff"
  },
  "authoring_profile": "graph_v0",
  "contract": "sley-tools.program.v0",
  "core": {
    "binary_sha256": "b2d8ce53051043cd86f0c071b16584053d9a08ec7af5d2d8a91fa3ab68a79e52",
    "commit": "af34be33eb1ae913dddd92aa7f4f275aac0e45ee",
    "profile": "extended_v1"
  },
  "entrypoint": {
    "function_id": "7fd222b64d60432d2da570bd0bc5626e38f7dcd9b70a6f26184f17105ddaa6a3",
    "name": "evaluate",
    "state_root": "1f60a3340dfd9cd9f947c6630fd5dcb3aa1b9a228ae54d3736543a7f4ac245c9"
  },
  "graph_recipe": {
    "path": "build/graph.json",
    "sha256": "49bd942520663c4915fefc7ecdbd81e3349d2b2fe017200b741466c6771d8d7c"
  },
  "host_responsibility": "decode bounded JSON Lines, keep case IDs and row order, call accepted native comparator/selector/reducer graphs, and serialize results",
  "inputs": {
    "baseline_archive_bytes": "SInt64",
    "baseline_cpu_us": "SInt64",
    "baseline_wall_us": "SInt64",
    "candidate_archive_bytes": "SInt64",
    "candidate_cpu_us": "SInt64",
    "candidate_wall_us": "SInt64"
  },
  "license_status": "Apache-2.0",
  "native_logic": "native checked signed deltas, independent regression flags, and a named negative-measurement policy",
  "output": {
    "fields": {
      "any_regression": "Bool",
      "archive_delta_bytes": "CheckedSInt64",
      "archive_regressed": "Bool",
      "cpu_delta_us": "CheckedSInt64",
      "cpu_regressed": "Bool",
      "invalid_input": "Bool",
      "wall_delta_us": "CheckedSInt64",
      "wall_regressed": "Bool"
    },
    "type": "Record"
  },
  "program_id": "benchmark-comparator",
  "program_version": "0.1.0-local",
  "purpose": "Compare one matched benchmark row with exact native deltas and independent regression flags",
  "result_fields": [
    {
      "member_id": "0101010101010101010101010101010101010101010101010101010101010101",
      "name": "wall_delta_us",
      "type": "CheckedSInt64"
    },
    {
      "member_id": "0202020202020202020202020202020202020202020202020202020202020202",
      "name": "cpu_delta_us",
      "type": "CheckedSInt64"
    },
    {
      "member_id": "0303030303030303030303030303030303030303030303030303030303030303",
      "name": "archive_delta_bytes",
      "type": "CheckedSInt64"
    },
    {
      "member_id": "0404040404040404040404040404040404040404040404040404040404040404",
      "name": "wall_regressed",
      "type": "Bool"
    },
    {
      "member_id": "0505050505050505050505050505050505050505050505050505050505050505",
      "name": "cpu_regressed",
      "type": "Bool"
    },
    {
      "member_id": "0606060606060606060606060606060606060606060606060606060606060606",
      "name": "archive_regressed",
      "type": "Bool"
    },
    {
      "member_id": "0707070707070707070707070707070707070707070707070707070707070707",
      "name": "any_regression",
      "type": "Bool"
    },
    {
      "member_id": "0808080808080808080808080808080808080808080808080808080808080808",
      "name": "invalid_input",
      "type": "Bool"
    }
  ],
  "result_type_id": "5dec23452921e01306cf8abf086a0117f1d1a2cc79946632faa913cf418396ce",
  "source_provenance": {
    "builder": "crates/backend/src/graph.rs",
    "core_commit": "af34be33eb1ae913dddd92aa7f4f275aac0e45ee"
  },
  "status": "portable_native_artifact",
  "test_cases": {
    "external_assertions": "sley-tools test --project PROJECT",
    "independent_oracle": "scripts/probe_checked_graph.py::oracle",
    "native_core_test_admission": "PENDING_CORE_EXECUTOR"
  },
  "title": "Benchmark Comparator",
  "tools_contract": "sley-tools.cli.v0",
  "worked_change": {
    "constant": "reject_negative_inputs",
    "evidence": "evidence/catalog/benchmark-comparator-v2.json",
    "example_value": false,
    "initial_value": true,
    "operation": "replace_named_constant"
  }
}
