{
  "artifact": {
    "contract": "sley-tools.native-graph-artifact.v1",
    "path": "artifact/native-graph.json",
    "sha256": "9a84a7be8dc53b850425f6fad26ac2c6e1ec818e59d893a2467b3e68a295638c"
  },
  "authoring_profile": "graph_v0",
  "contract": "sley-tools.program.v0",
  "core": {
    "binary_sha256": "b2d8ce53051043cd86f0c071b16584053d9a08ec7af5d2d8a91fa3ab68a79e52",
    "commit": "af34be33eb1ae913dddd92aa7f4f275aac0e45ee",
    "profile": "extended_v1"
  },
  "entrypoint": {
    "function_id": "4ebfe29d18255f9110a494d1dc32daf0e049db92cfa7adacb50bf04f5b6ee04c",
    "name": "evaluate",
    "state_root": "c2a18888c9366e4ebaac5013d1d6fa07739d576c491adfcf7c959fd810ff845e"
  },
  "graph_recipe": {
    "path": "build/graph.json",
    "sha256": "7ffe41c0a8d93763b148166bf8ff5b795c6bb60616341e39c3476a629f8f15d5"
  },
  "host_responsibility": "decode bounded JSON Lines, batch rows, call accepted native comparator/selector/reducer graphs, preserve case IDs and order, and serialize results",
  "inputs": {
    "left_archive_bytes": "SInt64",
    "left_count": "SInt64",
    "left_cpu_us": "SInt64",
    "left_wall_us": "SInt64",
    "right_archive_bytes": "SInt64",
    "right_count": "SInt64",
    "right_cpu_us": "SInt64",
    "right_wall_us": "SInt64"
  },
  "license_status": "Apache-2.0",
  "native_logic": "native checked addition for count and three totals, with a named policy for negative partial measurement totals",
  "output": {
    "fields": {
      "archive_total_bytes": "CheckedSInt64",
      "count": "CheckedSInt64",
      "cpu_total_us": "CheckedSInt64",
      "invalid_input": "Bool",
      "wall_total_us": "CheckedSInt64"
    },
    "type": "Record"
  },
  "program_id": "benchmark-summary-reducer",
  "program_version": "0.1.0-local",
  "purpose": "Combine two bounded benchmark summaries with native checked counts and totals",
  "result_fields": [
    {
      "member_id": "0101010101010101010101010101010101010101010101010101010101010101",
      "name": "count",
      "type": "CheckedSInt64"
    },
    {
      "member_id": "0202020202020202020202020202020202020202020202020202020202020202",
      "name": "wall_total_us",
      "type": "CheckedSInt64"
    },
    {
      "member_id": "0303030303030303030303030303030303030303030303030303030303030303",
      "name": "cpu_total_us",
      "type": "CheckedSInt64"
    },
    {
      "member_id": "0404040404040404040404040404040404040404040404040404040404040404",
      "name": "archive_total_bytes",
      "type": "CheckedSInt64"
    },
    {
      "member_id": "0505050505050505050505050505050505050505050505050505050505050505",
      "name": "invalid_input",
      "type": "Bool"
    }
  ],
  "result_type_id": "5ebba11533da22c9d6bd5a07730b1d4f1eebbfcbce3feefa218e5922277c2c91",
  "source_provenance": {
    "builder": "crates/backend/src/graph.rs",
    "core_commit": "af34be33eb1ae913dddd92aa7f4f275aac0e45ee"
  },
  "status": "portable_native_artifact",
  "test_cases": {
    "external_assertions": "sley-tools test --project PROJECT",
    "independent_oracle": "scripts/probe_data_pipe_native.py::reducer_oracle",
    "native_core_test_admission": "PENDING_CORE_EXECUTOR"
  },
  "title": "Benchmark Summary Reducer",
  "tools_contract": "sley-tools.cli.v0",
  "worked_change": {
    "constant": "reject_negative_totals",
    "evidence": "evidence/catalog/benchmark-summary-reducer-v2.json",
    "example_value": false,
    "initial_value": true,
    "operation": "replace_named_constant"
  }
}
