{"artifact":{"contract":"sley-tools.native-graph-artifact.v1","path":"artifact/native-graph.json","sha256":"585f45e80d809cf6fc3fbe42892b3e40a71a638c80ea74d589c28a20aef11537"},"authoring_profile":"graph_v0","contract":"sley-tools.program.v0","core":{"binary_sha256":"b2d8ce53051043cd86f0c071b16584053d9a08ec7af5d2d8a91fa3ab68a79e52","commit":"af34be33eb1ae913dddd92aa7f4f275aac0e45ee","profile":"extended_v1"},"entrypoint":{"function_id":"d019a64cfaa3185efea3e6602fe14db00f3b6c16156a08646b1a4ea0aac9bd95","name":"evaluate","state_root":"068d7c18eea9c5b69c75e7e6fdc15a960f175522d4673ed394d86f2b00bfeac8"},"graph_recipe":{"path":"build/graph.json","sha256":"f9fde8e7d039c529114addc62a878c730a14c1e9327f43baa866e942b89ac88d"},"host_responsibility":"Optional Python Schema Importer parses exact bounded JSON and projects root kind, property presence, raw kind, extra count, integrality, representability, and safe values; it does not decide schema validity. Original schema and source-to-entity mapping are stored in schema/.","inputs":{"extra_count":"UInt32","p0_kind":"Bool","p0_present":"Bool","p0_value":"Bool","p1_fits":"Bool","p1_kind":"Bool","p1_present":"Bool","p1_value":"SInt64","root_is_object":"Bool"},"license_status":"Apache-2.0","native_logic":"Accepted Sley graph decides root and property type, requiredness, extra-property, native integer representability, and declared numeric-bound validity from a typed JSON envelope.","output":{"fields":{"extra_properties":"Bool","p0_missing":"Bool","p0_wrong_type":"Bool","p1_missing":"Bool","p1_out_of_bounds":"Bool","p1_outside_native_range":"Bool","p1_wrong_type":"Bool","valid":"Bool","wrong_root":"Bool"},"type":"Record"},"program_id":"generated-payload-validator","program_version":"0.1.0-local","purpose":"Validate closed device-reading records under a declared JSON Schema profile","result_fields":[{"member_id":"0101010101010101010101010101010101010101010101010101010101010101","name":"valid","type":"Bool"},{"member_id":"0202020202020202020202020202020202020202020202020202020202020202","name":"wrong_root","type":"Bool"},{"member_id":"0303030303030303030303030303030303030303030303030303030303030303","name":"extra_properties","type":"Bool"},{"member_id":"0404040404040404040404040404040404040404040404040404040404040404","name":"p0_missing","type":"Bool"},{"member_id":"0505050505050505050505050505050505050505050505050505050505050505","name":"p0_wrong_type","type":"Bool"},{"member_id":"0606060606060606060606060606060606060606060606060606060606060606","name":"p1_missing","type":"Bool"},{"member_id":"0707070707070707070707070707070707070707070707070707070707070707","name":"p1_wrong_type","type":"Bool"},{"member_id":"0808080808080808080808080808080808080808080808080808080808080808","name":"p1_outside_native_range","type":"Bool"},{"member_id":"0909090909090909090909090909090909090909090909090909090909090909","name":"p1_out_of_bounds","type":"Bool"}],"result_type_id":"3f4a58cd72a45252a73c1a041b1e6e9b38e4dcb383d18a06c0c23db4a4077ec3","source_provenance":{"builder":"crates/backend/src/graph.rs","core_commit":"af34be33eb1ae913dddd92aa7f4f275aac0e45ee"},"status":"portable_native_artifact","test_cases":{"external_assertions":"sley-tools test --project PROJECT","independent_oracle":"tests/raw-cases.json","native_core_test_admission":"PENDING_CORE_EXECUTOR"},"title":"Generated Payload Validator","tools_contract":"sley-tools.cli.v0","worked_change":{"constant":"p1_maximum","evidence":"evidence/catalog/generated-payload-validator-v2.json","example_value":"12","initial_value":"10","operation":"replace_named_constant"}}
