{
  "artifact": {
    "contract": "sley-tools.native-graph-artifact.v1",
    "path": "artifact/native-graph.json",
    "sha256": "49e7d165c8940cfb8a7893f57ca9ecefcc3656cfcc9c4e919323aa80ea5f7997"
  },
  "authoring_profile": "graph_v0",
  "contract": "sley-tools.program.v0",
  "core": {
    "binary_sha256": "b2d8ce53051043cd86f0c071b16584053d9a08ec7af5d2d8a91fa3ab68a79e52",
    "commit": "af34be33eb1ae913dddd92aa7f4f275aac0e45ee",
    "profile": "extended_v1"
  },
  "entrypoint": {
    "function_id": "781781ba6513507b5c4b4fd66708113fa9a843e96e71cec1be2efcc767932d70",
    "name": "evaluate",
    "state_root": "ab442237dd02474374ced569a0048ddbf9c0af12b0467b6c796a59883514917f"
  },
  "graph_recipe": {
    "path": "build/graph.json",
    "sha256": "a1e3589a7c737413cc9a25c9e2a138c4ad70b4e82d4b7572439df50e720a4031"
  },
  "host_responsibility": "decode one signed input, manage the local workspace, and compare public expected results",
  "inputs": {
    "value": "SInt64"
  },
  "license_status": "Apache-2.0",
  "native_logic": "native threshold-order check and bronze/silver/gold branch decisions with an editable middle-tier gate",
  "output": {
    "fields": {
      "invalid_configuration": "Bool",
      "tier": "SInt64"
    },
    "type": "Record"
  },
  "program_id": "tier-classifier",
  "program_version": "0.1.0-local",
  "purpose": "Classify any signed value into bronze, silver, or gold with ordered editable thresholds and an explicit invalid-configuration result",
  "result_fields": [
    {
      "member_id": "0101010101010101010101010101010101010101010101010101010101010101",
      "name": "tier",
      "type": "SInt64"
    },
    {
      "member_id": "0202020202020202020202020202020202020202020202020202020202020202",
      "name": "invalid_configuration",
      "type": "Bool"
    }
  ],
  "result_type_id": "b3dfb5a631dbb7b072befbbe8d15b145aebe23421079c311446a1bc5f5c7c810",
  "source_provenance": {
    "builder": "crates/backend/src/graph.rs",
    "core_commit": "af34be33eb1ae913dddd92aa7f4f275aac0e45ee"
  },
  "status": "portable_native_artifact",
  "test_cases": {
    "external_assertions": "sley-tools test --project PROJECT",
    "independent_oracle": "scripts/probe_tier_catalog.py::tier_oracle",
    "native_core_test_admission": "PENDING_CORE_EXECUTOR"
  },
  "title": "Tier Classifier",
  "tools_contract": "sley-tools.cli.v0",
  "worked_change": {
    "constant": "bronze_max",
    "evidence": "evidence/catalog/tier-classifier-v2.json",
    "example_value": "12",
    "initial_value": "10",
    "operation": "replace_named_constant"
  }
}
